GRP,61,2,2018,"Jack E. Norland, Cami S. Dixon, Diane L. Larson, Kristine L. Askerooth and Benjamin A. Geaumont",Prairie Reconstruction Unpredictability and Complexity: What is the Rate of Reconstruction Failures?,Ecological Restoration,NA,NA,R-S,NA,NA,NA,NA
GRP,62,1,2019,"Mortenson, Adam Jacob, Norland, Jack",A study of prairie reconstructions in the Eastern Dakotas,"Thesis, North Dakota State University",NA,NA,R-S,NA,NA,NA,NA
GRP,63,1,2021,"Ashish N. Nerlekar, Nirav Mehta, Ritesh Pokar, Mayur Bhagwat, Chetan Misher, Pankaj Joshi, Ankila J. Hiremath",Removal or utilisation? Testing alternative approaches to the management of an invasive woody legume in an arid Indian grassland,Restoration Ecology,NA,https://doi.org/10.1111/rec.13477,R-S,NA,NA,NA,NA
GRP,64,1,2019,"Sperry, KP; Hilfer, H; Lane, I; Petersen, J; Dixon, PM; Sullivan, LL",Species diversity and dispersal traits alter biodiversity spillover in reconstructed grasslands,JOURNAL OF APPLIED ECOLOGY,10.1111/1365-2664.13469,http://doi.org/10.1111/1365-2664.13469,OA,6.17.2021,"Katie Sperry, Hayley Hilfer, Ian Lane, Jessica Petersen, Phil Dixon, & Lauren Sullivan. (2019, June 21). Species diversity and movement traits alter biodiversity spillover in reconstructed grasslands. Journal of Applied Ecology. Zenodo. http://doi.org/10.5281/zenodo.3252034",CC-BY,NA
GRP,65,1,2016,"Peter Lesica, David Hanna, Nathan Birkeland",Choosing Species to Enhance Native Plant Abundance Following Biological Control of Leafy Spurge (Euphorbia esula),Ecological Restoration,doi: 10.3368/er.34.1.3,http://er.uwpress.org/content/34/1/3.full.pdf+html?sid=2e2469f4-b65c-4d6c-9d37-e9995bcd786d,R-S,NA,NA,NA,NA
GRP,66,1,2020,"Michal Hyjek, Petra Hájková & Jan Roleček",A novel dataset of permanent plots in extremely species-rich temperate grasslands,Folia Geobotanica,10.1007/s12224-020-09372-6,https://doi.org/10.1007/s12224-020-09372-6,OA,NA,NA,NA,NA
GRP,67,1,2015,"Rhoades, CC; Fornwalt, PJ; Paschke, MW; Shanklin, A; Jonas, JL",Recovery of small pile burn scars in conifer forests of the Colorado Front Range,FOREST ECOLOGY AND MANAGEMENT,10.1016/j.foreco.2015.03.026,http://doi.org/10.1016/j.foreco.2015.03.026,OA,06.28.2021,"Shanklin, Amber M.; Rhoades, Charles C.; Fornwalt, Paula J.; Paschke, Mark W. 2014. Vegetation, soils, and landscape data for experimental rehabilitation of slash pile fire scars in conifer forests of the Front Range, Colorado. Fort Collins, CO: Forest Service Research Data Archive. https://doi.org/10.2737/RDS-2019-0027",CC-BY-ND,NA
GRP,68,1,2020,"Becky K. Kerns, Michelle A. Day, Dana Ikeda",Long-Term Seeding Outcomes in Slash Piles and Skid Trails after Conifer Removal,Forests,NA,https://doi.org/10.3390/f11080839,OA,06.28.2021,"Day, Michelle A.; Kerns, Becky K. 2020. Long-term effects of restoration treatments in a juniper woodland invaded by annual exotic grasses: juniper removal, pile burning and native seeding. Fort Collins, CO: Forest Service Research Data Archive. https://doi.org/10.2737/RDS-2020-0032",CC-BY-ND,NA
GRP,70,1,2019,"Wohlwend, MR; Schutzenhofer, MR; Knight, TM",Long-term experiment manipulating community assembly results in favorable restoration outcomes for invaded prairies,RESTORATION ECOLOGY,10.1111/rec.13006,http://doi.org/10.1111/rec.13006,R-S,NA,NA,NA,NA
GRP,71,1,2017,"Wolff, C; Gilhaus, K; Holzel, N; Schneider, S",Status and restoration potential of heathlands and sand grasslands in the southwest of Luxembourg,TUEXENIA,10.14471/2017.37.007,http://doi.org/10.14471/2017.37.007,OA,NA,NA,NA,NA
GRP,72,1,2021,"B.A. Woodcock, R.F. Pywell, N.A. Macgregor, M.E. Edwards d, J. Redhead, L. E. Ridding, P. Batary, M. Czerwinski, S. Duffield","Historical, local and landscape factors determine the success of grassland restoration for arthropods","Agriculture, Ecosystems and Environment",10.1016/j.agee.2020.107271,https://doi.org/10.1016/j.agee.2020.107271,R-S,NA,NA,NA,NA
GRP,73,1,2020,"Paula Comeau, Jack E. Norland , Cami S. Dixon , Kristine L. Askerooth and Kyle Kelsey",Reducing Cirsium arvense (Canada Thistle) Using Spike Seeding: Six Years Later,Ecological Restoration,10.3368/er.38.2.67,https://doi.org/10.3368/er.38.2.67,R-S,NA,NA,NA,NA
