GRP,6,1,2017,"Khalil, MI; Gibson, DJ; Baer, SG",Phylogenetic diversity reveals hidden patterns related to population source and species pools during restoration,JOURNAL OF APPLIED ECOLOGY,10.1111/1365-2664.12743,http://doi.org/10.1111/1365-2664.12743,NA,02.18.2020,"Khalil, Mohammed I.; Gibson, David J.; Baer, Sara G. (2017), Data from: Phylogenetic diversity reveals hidden patterns related to population source and species pools during restoration, Dryad, Dataset, https://doi.org/10.5061/dryad.122j7",CC0,CC0
GRP,7,1,1999,"Edward L. Webb, Rodolfo Peralta","Tree community diversity of lowland swamp forest in Northeast Costa Rica, and changes associated with controlled selective logging",Biodiversity and Conservation,NA,https://doi.org/10.1023/A:1008892016370,NA,NA,NA,NA,NA
GRP,8,1,2016,"Baer, SG; Blair, JM; Collins, SL",Environmental heterogeneity has a weak effect on diversity during community assembly in tallgrass prairie,ECOLOGICAL MONOGRAPHS,10.1890/15-0888.1,http://doi.org/10.1890/15-0888.1,NA,01.15.2020,"Baer, Sara G.; Blair, John M.; Collins, Scott L. (2015), Data from: Environmental heterogeneity has a weak effect on diversity during community assembly in tallgrass prairie, Dryad, Dataset, https://doi.org/10.5061/dryad.c2v92",CC0,CC0
GRP,9,1,2018,"Flint, SA; Jordan, NR; Shaw, RG",Plant community response to switchgrass (Panicum virgatum) population source in establishing prairies,ECOLOGICAL APPLICATIONS,10.1002/eap.1772,http://doi.org/10.1002/eap.1772,NA,02.24.2020,"Flint, Shelby A.; Jordan, Nicholas R.; Shaw, Ruth G. (2018), Data from: Plant community response to switchgrass (Panicum virgatum) population source in establishing prairies, Dryad, Dataset, https://doi.org/10.5061/dryad.q08mn53",CC0,CC0
GRP,10,2,2017,"Zirbel, CR; Bassett, T; Grman, E; Brudvig, LA",Plant functional traits and environmental conditions shape community assembly and ecosystem functioning during restoration,JOURNAL OF APPLIED ECOLOGY,10.1111/1365-2664.12885,http://doi.org/10.1111/1365-2664.12885,NA,01.15.2020,"Zirbel, Chad R.; Basset, Tyler; Grman, Emily; A. Brudvig, Lars; Zirbel, Chad (2017): Data from: Plant functional traits and environmental conditions shape community assembly and ecosystem functioning during restoration. Dryad. Collection. https://doi.org/10.5061/dryad.2175q",CC0,CC0
GRP,10,1,2015,"Grman, E; Bassett, T; Zirbel, CR; Brudvig, LA",Dispersal and establishment filters influence the assembly of restored prairie plant communities,RESTORATION ECOLOGY,10.1111/rec.12271,http://doi.org/10.1111/rec.12271,NA,01.15.2020,NA,NA,NA
GRP,11,1,2015,"Erika C. Brandt, John E. Petersen, Jake J. Grossman, George A. Allen, David H. Benzing",Relationships between Spatial Metrics and Plant Diversity in Constructed Freshwater Wetlands,PLOS ONE,10.1371/journal.pone.0135917,https://www.ncbi.nlm.nih.gov/pmc/articles/PMC4546644/,NA,02.25.2020,"Brandt, Erika C. et al. (2015), Data from: Relationships between spatial metrics and plant diversity in constructed freshwater wetlands, Dryad, Dataset, https://doi.org/10.5061/dryad.r95dh",CC0,CC0
GRP,12,1,2019,"Hall, SJG; Bunce, RGH",The use of cattle Bos taurus for restoring and maintaining holarctic landscapes: Conclusions from a long-term study (1946-2017) in northern England,ECOLOGY AND EVOLUTION,10.1002/ece3.5169,http://doi.org/10.1002/ece3.5169,NA,02.24.2020,"Hall, Stephen J. G.; Bunce, Robert G. H. (2019), Data from: The use of cattle Bos taurus for restoring and maintaining holarctic landscapes: conclusions from a long-term study (1946-2017) in northern England, Dryad, Dataset, https://doi.org/10.5061/dryad.2gm8348",CC0,CC0
GRP,13,1,2016,"Kenny Helsen, Martin Hermy and Oliver Honnay",A test of priority effect persistence in semi‑natural grasslands through the removal of plant functional groups during community assembly,BMC Ecology,10.1186/s12898-016-0077-9,https://bmcecol.biomedcentral.com/articles/10.1186/s12898-016-0077-9,NA,02.24.2020,"Helsen, Kenny; Hermy, Martin; Honnay, Olivier (2017), Data from: A test of priority effect persistence in semi-natural grasslands through the removal of plant functional groups during community assembly, Dryad, Dataset, https://doi.org/10.5061/dryad.7s5s4",CC0,CC0
GRP,14,1,2016,"Livingston, AC; Varner, JM; Jules, ES; Kane, JM; Arguello, LA",Prescribed fire and conifer removal promote positive understorey vegetation responses in oak woodlands,JOURNAL OF APPLIED ECOLOGY,10.1111/1365-2664.12703,http://doi.org/10.1111/1365-2664.12703,NA,02.25.2020,"Livingston, Amy C. et al. (2017), Data from: Prescribed fire and conifer removal promote positive understorey vegetation responses in oak woodlands, Dryad, Dataset, https://doi.org/10.5061/dryad.4s209",CC0,CC0
GRP,15,1,2006,Katherine Nash Suding and Katherine L. Gross,MODIFYING NATIVE AND EXOTIC SPECIES RICHNESS CORRELATIONS: THE INFLUENCE OF FIRE AND SEED ADDITION,Ecological Applications,NA,https://doi.org/10.1890/1051-0761(2006)016[1319:MNAESR]2.0.CO;2,NA,01.15.2020,NA,NA,NA
GRP,16,1,2017,"Tara J. Zamin, Alex Jolly, Steve Sinclair, John W. Morgan, Joslin L. Moore",Enhancing plant diversity in a novel grassland using seed addition,Journal of Applied Ecology,10.1111/1365-2664.12963,https://doi.org/10.1111/1365-2664.12963,NA,01.15.2020,"Zamin, Tara J. et al. (2018), Data from: Enhancing plant diversity in a novel grassland using seed addition, Dryad, Dataset, https://doi.org/10.5061/dryad.3913b",CC0,CC0
GRP,17,1,2020,"Zirbel, CR; Brudvig, LA",Trait-environment interactions affect plant establishment success during restoration,ECOLOGY,10.1002/ecy.2971,http://doi.org/10.1002/ecy.2971,NA,02.17.2020,"Zirbel, Chad; Brudvig, Lars (2020), Data from: Trait-environment interactions affect plant establishment success during restoration, v3, Dryad, Dataset, https://doi.org/10.5061/dryad.bnzs7h46q",CC0,CC0
GRP,18,1,2015,"Myers, MC; Mason, JT; Hoksch, BJ; Cambardella, CA; Pfrimmer, JD","Birds and butterflies respond to soil-induced habitat heterogeneity in experimental plantings of tallgrass prairie species managed as agroenergy crops in Iowa, USA",JOURNAL OF APPLIED ECOLOGY,10.1111/1365-2664.12503,http://doi.org/10.1111/1365-2664.12503,NA,02.15.2020,"Myers, Mark C. et al. (2016), Data from: Birds and butterflies respond to soil-induced habitat heterogeneity in experimental plantings of tallgrass prairie species managed as agroenergy crops in Iowa, USA, Dryad, Dataset, https://doi.org/10.5061/dryad.4ft7n",CC0,CC0
GRP,19,3,2007,"Jongepierova, I; Mitchley, J; Tzanopoulos, J",A field experiment to recreate species rich hay meadows using regional seed mixtures,BIOLOGICAL CONSERVATION,10.1016/j.biocon.2007.07.026,http://doi.org/10.1016/j.biocon.2007.07.026,NA,NA,NA,NA,NA
GRP,19,1,2014,"Karel Prach, Ivana Jongepierová, Klára Rehounková, Karel Fajmon",Restoration of grasslands on ex-arable land using regional and commercial seed mixtures and spontaneous succession: Successional trajectories and changes in species richness,"Agriculture, Ecosystems and Environment",NA,http://dx.doi.org/10.1016/j.agee.2013.06.003,NA,NA,NA,NA,NA
GRP,19,2,2012,"Karel Prach, Ivana Jongepierova,  Klara Rehounkova",Large-Scale Restoration of Dry Grasslands on Ex-Arable Land Using a Regional Seed Mixture: Establishment of Target Species,Restoration Ecology,10.1111/j.1526-100X.2012.00872.x,https://doi.org/10.1111/j.1526-100X.2012.00872.x,NA,NA,NA,NA,NA
GRP,20,1,2017,"Barbara C. Schmid, Peter Poschlod, Honor C. Prentice",The contribution of successional grasslands to the conservation of semi-natural grasslands species – A landscape perspective,Biological Conservation,NA,http://dx.doi.org/10.1016/j.biocon.2016.12.002.,NA,02.24.2020,"Schmid, Barbara C. et al. (2019), Data from: The contribution of successional grasslands to the conservation of semi-natural grasslands species – A landscape perspective, v2, Dryad, Dataset, https://doi.org/10.5061/dryad.8gtht76jx",CC0,CC0
GRP,21,1,2019,"Adam Thomas Clark, Johannes M. H. Knops, Dave Tilman",Contingent factors explain average divergence in functional composition over 88 years of old field succession,Journal of Ecology,10.1111/1365-2745.13070,https://doi.org/10.1111/1365-2745.13070,NA,NA,NA,NA,NA
GRP,22,1,2016,Bryan Foster,"Long-term studies of secondary succession and community assembly in the prairie-forest ecotone of eastern Kansas, Hay meadow restoration experiment",NA,NA,NA,NA,01.15.2020,"Foster B. 2016. Long-term studies of secondary succession and community assembly in the prairie-forest ecotone of eastern Kansas, Old-field succession experiment. Environmental Data Initiative. https://doi.org/10.6073/pasta/a30d5b90676008cfb7987f31b4343a35. Dataset accessed 3/25/2020.",NA,NA
GRP,23,1,2015,Pablo Becerra,The effect of climate and vegetation on recruitment of woody species in central Chile,NA,NA,NA,NA,NA,NA,NA,NA
GRP,24,1,2017,"Emma Ladouceur, Margaret M. Mayfield",The early response of subtropical tussock grasslands to restoration treatments,Restoration Ecology,10.1111/rec.12491,https://doi.org/10.1111/rec.12491,NA,NA,NA,NA,NA
GRP,25,1,2017,"Young, TP; Stuble, KL; Balachowski, JA; Werner, CM",Using priority effects to manipulate competitive relationships in restoration,RESTORATION ECOLOGY,10.1111/rec.12384,http://doi.org/10.1111/rec.12384,NA,01.15.2020,NA,NA,NA
GRP,25,2,2017,"Stuble, KL; Zefferman, EP; Wolf, KM; Vaughn, KJ; Young, TP",Outside the envelope: rare events disrupt the relationship between climate factors and species interactions,ECOLOGY,10.1002/ecy.1820,http://doi.org/10.1002/ecy.1820,NA,01.15.2020,NA,NA,NA
GRP,26,1,2010,"Torok, P; Deak, B; Vida, E; Valko, O; Lengyel, S; Tothmeresz, B",Restoring grassland biodiversity: Sowing low-diversity seed mixtures can lead to rapid favourable changes,BIOLOGICAL CONSERVATION,10.1016/j.biocon.2009.12.024,http://doi.org/10.1016/j.biocon.2009.12.024,NA,NA,NA,NA,NA
GRP,27,1,2016,"Manuel E. Lucas-Borja, Javier Madrigal, David Candel-Pérez, Enrique Jiménez, Daniel Moya, Jorge de las Heras, Mercedes Guijarro, José Antonio Vega, Cristina Fernández, Carmen Hernando","Effects of prescribed burning, vegetation treatment and seed predation on natural regeneration of Spanish black pine (Pinus nigra Arn. ssp. salzmannii) in pure and mixed forest stands",Forest Ecology and Management,10.1016/j.foreco.2016.07.019,http://dx.doi.org/10.1016/j.foreco.2016.07.019,NA,NA,NA,NA,NA
GRP,28,1,2019,"Paul A. Schmalzer, Tammy E. Foster",Restoration of Florida scrub vegetation in an old field through 23 years after planting,Restoration Ecology,10.1111/rec.12864,https://onlinelibrary.wiley.com/doi/full/10.1111/rec.12864,NA,01.15.2020,NA,NA,NA
GRP,29,1,2017,"Barber, NA; Jones, HP; Duvall, MR; Wysocki, WP; Hansen, MJ; Gibson, DJ",Phylogenetic diversity is maintained despite richness losses over time in restored tallgrass prairie plant communities,JOURNAL OF APPLIED ECOLOGY,10.1111/1365-2664.12639,http://doi.org/10.1111/1365-2664.12639,NA,03.30.2020,"Barber, Nicholas A. et al. (2017), Data from: Phylogenetic diversity is maintained despite richness losses over time in restored tallgrass prairie plant communities, Dryad, Dataset, https://doi.org/10.5061/dryad.5m30d",CC0,CC0
GRP,29,2,2014,"Hansen, MJ; Gibson, DJ",Use of multiple criteria in an ecological assessment of a prairie restoration chronosequence,APPLIED VEGETATION SCIENCE,10.1111/avsc.12051,http://doi.org/10.1111/avsc.12051,NA,NA,NA,NA,NA
GRP,30,1,2016,"Bourgeois, B; Vanasse, A; Gonzalez, E; Andersen, R; Poulin, M",Threshold dynamics in plant succession after tree planting in agricultural riparian zones,JOURNAL OF APPLIED ECOLOGY,10.1111/1365-2664.12675,http://doi.org/10.1111/1365-2664.12675,NA,03.30.2020,"Bourgeois, Bérenger et al. (2016), Data from: Threshold dynamics in plant succession after tree planting in agricultural riparian zones, Dryad, Dataset, https://doi.org/10.5061/dryad.b46k4",CC0,CC0
GRP,31,1,2018,"Chen, HYH; Biswas, SR; Sobey, TM; Brassard, BW; Bartels, SF",Reclamation strategies for mined forest soils and overstorey drive understorey vegetation,JOURNAL OF APPLIED ECOLOGY,10.1111/1365-2664.13018,http://doi.org/10.1111/1365-2664.13018,NA,03.30.2020,"Chen, Han Y. H. et al. (2018), Data from: Reclamation strategies for mined forest soils and overstorey drive understorey vegetation, Dryad, Dataset, https://doi.org/10.5061/dryad.c49m0",CC0,CC0
GRP,32,1,2017,"Douda, J; Boublik, K; Doudova, J; Kyncl, M",Traditional forest management practices stop forest succession and bring back rare plant species,JOURNAL OF APPLIED ECOLOGY,10.1111/1365-2664.12801,http://doi.org/10.1111/1365-2664.12801,NA,03.30.2020,"Douda, Jan; Boublík, Karel; Doudová, Jana; Kyncl, Michal (2016), Data from: Traditional forest management practices stop forest succession and bring back rare plant species, Dryad, Dataset, https://doi.org/10.5061/dryad.kr6hg",CC0,CC0
GRP,33,1,2018,"Zimmerman, CL; Shirer, RR; Corbin, JD",Native Plant Recovery following Three Years of Common Reed (Phragmites australis) Control,INVASIVE PLANT SCIENCE AND MANAGEMENT,10.1017/inp.2018.24,http://doi.org/10.1017/inp.2018.24,NA,03.27.2021,"Zimmerman, Christopher L.; Shirer, Rebecca R.; Corbin, Jeffrey D. (2018), Data from: Native plant recovery following three years of common reed (Phragmites australis) control, Dryad, Dataset, https://doi.org/10.5061/dryad.63227hg",CC0,CC0
GRP,34,1,2015,"Fournier, B; Gillet, F; Le Bayon, RC; Mitchell, EAD; Moretti, M",Functional responses of multitaxa communities to disturbance and stress gradients in a restored floodplain,JOURNAL OF APPLIED ECOLOGY,10.1111/1365-2664.12493,http://doi.org/10.1111/1365-2664.12493,NA,03.30.2020,"Fournier, Bertrand et al. (2015), Data from: Functional responses of multi-taxa communities to disturbance and stress gradients in a restored floodplain, Dryad, Dataset, https://doi.org/10.5061/dryad.cb312",CC0,CC0
GRP,35,1,2019,"Fraaije, RGA; Poupin, C; Verhoeven, JTA; Soons, MB",Functional responses of aquatic and riparian vegetation to hydrogeomorphic restoration of channelized lowland streams and their valleys,JOURNAL OF APPLIED ECOLOGY,10.1111/1365-2664.13326,http://doi.org/10.1111/1365-2664.13326,NA,03.27.2020,"Fraaije, Rob G.A. et al. (2018), Data from: Functional responses of aquatic and riparian vegetation to hydrogeomorphic restoration of channelized lowland streams and their valleys, Dryad, Dataset, https://doi.org/10.5061/dryad.5874v7h",CC0,CC0
GRP,36,1,2016,"Gallagher, MK; Wagenius, S",Seed source impacts germination and early establishment of dominant grasses in prairie restorations,JOURNAL OF APPLIED ECOLOGY,10.1111/1365-2664.12564,http://doi.org/10.1111/1365-2664.12564,NA,03.30.2020,"Gallagher, M. Kate; Wagenius, Stuart (2016), Data from: Seed source impacts germination and early establishment of dominant grasses in prairie restorations, Dryad, Dataset, https://doi.org/10.5061/dryad.r7g8q",CC0,CC0
GRP,37,1,2019,"Halpern, CB; Antos, JA; Kothari, S; Olson, AM",Past tree influence and prescribed fire exert strong controls on reassembly of mountain grasslands after tree removal,ECOLOGICAL APPLICATIONS,10.1002/eap.1860,http://doi.org/10.1002/eap.1860,NA,03.27.2020,"Halpern, Charles B.; Antos, Joseph A.; Kothari, Shan; Olson, Annette M. (2019), Data from: Past tree influence and prescribed fire exert strong controls on reassembly of mountain grasslands after tree removal, Dryad, Dataset, https://doi.org/10.5061/dryad.v5f76v4",CC0,CC0
GRP,38,1,2018,"Jamsranjav, C; Reid, RS; Fernandez-Gimenez, ME; Tsevlee, A; Yadamsuren, B; Heiner, M",Applying a dryland degradation framework for rangelands: the case of Mongolia,ECOLOGICAL APPLICATIONS,10.1002/eap.1684,http://doi.org/10.1002/eap.1684,NA,03.30.2020,"Jamsranjav, Chantsallkham et al. (2017), Data from: Applying a dryland degradation framework for rangelands: the case of Mongolia, Dryad, Dataset, https://doi.org/10.5061/dryad.3ch50",CC0,CC0
GRP,39,1,2018,"Li, LP; Cadotte, MW; Martinez-Garza, C; de la Pena-Domene, M; Du, GZ",Planting accelerates restoration of tropical forest but assembly mechanisms appear insensitive to initial composition,JOURNAL OF APPLIED ECOLOGY,10.1111/1365-2664.12976,http://doi.org/10.1111/1365-2664.12976,NA,03.30.2020,"Li, Lanping et al. (2018), Data from: Plantings accelerate restoration of tropical forest but assembly mechanisms appear insensitive to initial composition, Dryad, Dataset, https://doi.org/10.5061/dryad.sh0v5",CC0,CC0
GRP,40,1,2019,"Lishawa, SC; Lawrence, BA; Albert, DA; Larkin, DJ; Tuchman, NC",Invasive species removal increases species and phylogenetic diversity of wetland plant communities,ECOLOGY AND EVOLUTION,10.1002/ece3.5188,http://doi.org/10.1002/ece3.5188,NA,03.27.2020,"Lishawa, Shane C. et al. (2019), Data from: Invasive species removal increases species and phylogenetic diversity of wetland plant communities, Dryad, Dataset, https://doi.org/10.5061/dryad.32h05c2",CC0,CC0
GRP,41,1,2017,"Matos, FAR; Magnago, LFS; Gastauer, M; Carreiras, JMB; Simonelli, M; Meira-Neto, JAA; Edwards, DP",Effects of landscape configuration and composition on phylogenetic diversity of trees in a highly fragmented tropical forest,JOURNAL OF ECOLOGY,10.1111/1365-2745.12661,http://doi.org/10.1111/1365-2745.12661,NA,03.30.2020,"Matos, Fabio Antonio R. et al. (2017), Data from: Effects of landscape configuration and composition on phylogenetic diversity of trees in a highly fragmented tropical forest, Dryad, Dataset, https://doi.org/10.5061/dryad.fq988",CC0,CC0
GRP,42,1,2017,"Tonietto, RK; Ascher, JS; Larkin, DJ","Bee communities along a prairie restoration chronosequence: similar abundance and diversity, distinct composition",ECOLOGICAL APPLICATIONS,10.1002/eap.1481,http://doi.org/10.1002/eap.1481,NA,03.30.2020,"Tonietto, Rebecca K.; Ascher, John S.; Larkin, Daniel J. (2016), Data from: Bee communities along a prairie restoration chronosequence: similar abundance and diversity, distinct composition, Dryad, Dataset, https://doi.org/10.5061/dryad.34n83",CC0,CC0
GRP,43,1,2019,"van Breugel, M; Craven, D; Lai, HR; Baillon, M; Turner, BL; Hall, JS",Soil nutrients and dispersal limitation shape compositional variation in secondary tropical forests across multiple scales,JOURNAL OF ECOLOGY,10.1111/1365-2745.13126,http://doi.org/10.1111/1365-2745.13126,NA,03.27.2020,"van Breugel, Michiel et al. (2018), Data from: Soil nutrients and dispersal limitation shape compositional variation in secondary tropical forests across multiple scales, Dryad, Dataset, https://doi.org/10.5061/dryad.4t46jj6",CC0,CC0
GRP,44,1,2016,Bryan  Foster," Long-term studies of secondary succession and community assembly in the prairie-forest ecotone of eastern Kansas, Old-field succession experiment",NA,NA,NA,NA,01.15.2020,"Foster B. 2016. Long-term studies of secondary succession and community assembly in the prairie-forest ecotone of eastern Kansas, Old-field succession experiment. Environmental Data Initiative. https://doi.org/10.6073/pasta/a30d5b90676008cfb7987f31b4343a35. Dataset accessed 4/09/2020.",NA,NA
GRP,45,1,2017,"Barak, RS; Williams, EW; Hipp, AL; Bowles, ML; Carr, GM; Sherman, R; Larkin, DJ",Restored tallgrass prairies have reduced phylogenetic diversity compared with remnants,JOURNAL OF APPLIED ECOLOGY,10.1111/1365-2664.12881,http://doi.org/10.1111/1365-2664.12881,NA,01.15.2020,"Barak, Rebecca S. et al. (2018), Data from: Restored tallgrass prairies have reduced phylogenetic diversity compared with remnants, Dryad, Dataset, https://doi.org/10.5061/dryad.90124",CC0,CC0
GRP,46,1,2017,"Timo Conradi, Vicky M. Temperton and Johannes Kollmann",Resource availability determines the importance of niche-based versus stochastic community assembly in grasslands,Oikos,NA,https://onlinelibrary.wiley.com/doi/full/10.1111/oik.03969,NA,01.15.2021,"Conradi, Timo; Temperton, Vicky M.; Kollmann, Johannes (2017), Data from: Resource availability determines the importance of niche-based vs. stochastic community assembly in grasslands, Dryad, Dataset, https://doi.org/10.5061/dryad.34d3n",CC0,CC0
GRP,47,1,2018,"Gregory Sonnier,  Patrick Bohlen, Hilary Swain, Steve Orzell, Edwin Bridges, Elizabeth Boughton, Gabriel Kamener","A case study of the effects of wetland restoration on the hydrology, species diversity, species composition and floristic quality of restored wetlands within a Central Florida ranchland, 2003 - ongoing.",NA,10.6073/pasta/b745934d136ce9ca8de26c5063eee86a,NA,NA,01.15.2022,"Sonnier, G., P.J. Bohlen, H.M. Swain, S.L. Orzell, E.L. Bridges, and E.H. Boughton. 2018. A case study of the effects of wetland restoration on the hydrology, species diversity, species composition and floristic quality of restored wetlands within a Central Florida ranchland, 2003 - ongoing. ver 1. Environmental Data Initiative. https://doi.org/10.6073/pasta/b745934d136ce9ca8de26c5063eee86a. Accessed 2020-04-10.",CC0,CC0
GRP,48,1,2004,"Robert Buchsbaum, John Catena, Eric Hutchins",Plant species percent cover in quadrats along vegetation transects at the Argilla Rd. salt marsh restoration site (Ipswich) and Rough Meadows reference marsh (Rowley – Stackyard Road area).,NA,NA, http://ecosystems.mbl.edu/PIE/data/LTE/LTE-EX-ARGILLA-RM-VEGQUADS.html,NA,01.15.2023,NA,NA,NA
GRP,49,1,2016,"Johnson, LR; Handel, SN",Restoration treatments in urban park forests drive long-term changes in vegetation trajectories,ECOLOGICAL APPLICATIONS,10.1890/14-2063,http://doi.org/10.1890/14-2063,NA,06.01.20,University of Maryland and L. Johnson. 2016. Data for L.R. Johnson and S.N. Handel - Restoration treatments in urban park forests drive long-term changes in vegetation trajectories - Ecological Applications doi:10.1890/14-2063.1 ver 150. Environmental Data Initiative. https://doi.org/10.6073/pasta/96ac7ad2d051559fdd8d977a7f45a881 (Accessed 2020-06-01).,NA,NA
GRP,52,1,2001,DAVID W. PETERSON AND PETER B. REICH,PRESCRIBED FIRE IN OAK SAVANNA: FIRE FREQUENCY EFFECTS ON STAND STRUCTURE AND DYNAMICS,Ecological Applications,10.1890/1051-0761(2001)011[0914:PFIOSF]2.0.CO;2,https://doi.org/10.1890/1051-0761(2001)011[0914:PFIOSF]2.0.CO;2,NA,05.06.20,"Reich, P. 2018. Plant density: Effect of Burning Patterns on Vegetation in the Fish Lake Burn Compartments ver 8. Environmental Data Initiative. https://doi.org/10.6073/pasta/fe139acf2f45e75fcbe684284952d93b (Accessed 2020-08-10).",CC BY,CC BY
GRP,54,1,2012,"LAUREN M. HALLETT, JOANNA S. HSU, ELSA E. CLELAND, SCOTT L. COLLINS, TIMOTHY L. DICKSON, EMILY C. FARRER, LAUREANO A. GHERARDI, KATHERINE L. GROSS, RICHARD J. HOBBS, LAURA TURNBULL, AND KATHARINE N. SUDING",Biotic mechanisms of community stability shift along a precipitation gradient,Ecology,10.1890/13-0895.1,http://dx.doi.org/10.1890/13-0895.1,NA,03.06.20,"Hallett, L., J. Hsu, E. Cleland, S. Collins, T. Diskson, E. Farrer, L. Gherardi, K. Gross, R. Hobbs, L. Turnbull, K. Suding, J. Bartolome, and P. Hopkinson. 2019. Combined data on plant species abundance and composition from LTER and other grasslands in the United States, 1943 - 2010 ver 3. Environmental Data Initiative. https://doi.org/10.6073/pasta/1f677c39993cbdd2739cef7ad8dd758e (Accessed 2020-08-17).",CC0,CC0
GRP,55,1,2009,SHARON K. COLLINGE AND CHRIS RAY,Transient patterns in the assembly of vernal pool plant communities,Ecology,10.1890/08-2155.1,https://doi.org/10.1890/08-2155.1,NA,01.06.20,"Collinge, S.K. and A.M. Faist. 2020. Long Term Research in Environmental Biology (LTREB): California vernal pool plant community ecology and restoration, 2000-2017 ver 2. Environmental Data Initiative. https://doi.org/10.6073/pasta/1daedb3a3b601d0fd9ccb4120cfb504e (Accessed 2020-08-20).",CC BY,CC BY
GRP,56,1,2018,Johannes Knops,Plant species percent cover data: Effect of Fire Frequency on Grassland Vegetation and Soils,LTER,doi:10.6073/pasta/0496cc0fd5bd68da780da66df779406d,https://portal.edirepository.org/nis/mapbrowse?packageid=knb-lter-cdr.94.8,NA,05.06.20,"Knops, J. 2018. Plant species percent cover data: Effect of Fire Frequency on Grassland Vegetation and Soils ver 8. Environmental Data Initiative. https://doi.org/10.6073/pasta/0496cc0fd5bd68da780da66df779406d (Accessed 2020-08-21).",CC BY,CC BY
GRP,57,1,1998,"Debra P. Coffin, William A. Laycock & William K. Lauenroth",Disturbance intensity and above- and belowground herbivory effects on long-term (14 y) recovery of a semiarid grassland,Plant Ecology,NA,https://link.springer.com/article/10.1023/A:1009789017151,NA,05.06.20,"Lauenroth, W. 2014. SGS-LTER Disturbance intensity and above- and belowground herbivory effects on long-term recovery of shortgrass steppe on the Central Plains Experimental Range, Nunn, Colorado, USA 1977-1990 ver 18. Environmental Data Initiative. https://doi.org/10.6073/pasta/9bad1dcc57df3e87c13a6987682183ba (Accessed 2020-08-24).",NA,NA
GRP,58,1,2020,Andrew D. Kaul  Brian J. Wilsey,Exotic species drive patterns of plant species diversity in 93 restored tallgrass prairies,Ecological Applications,10.1002/eap.2252,https://doi.org/10.1002/eap.2252,NA,NA,NA,NA,NA
GRP,59,1,NA,"Bouazza, Karma",Lebanon Reforestation Initiative (LRI),NA,NA,NA,NA,NA,NA,NA,NA
GRP,60,1,2020,Diane L. Larson  Daniel L. Hernández  Jennifer L. Larson  Julia B. Leone  Nora Pennarola,Management of remnant tallgrass prairie by grazing or fire: effects on plant communities and soil properties,Ecosphere,https://doi.org/10.1002/ecs2.3213,https://esajournals.onlinelibrary.wiley.com/doi/full/10.1002/ecs2.3213,NA,24.11.20,"Larson, D.L., Hernández, D.L., Larson, J.L., Leone, J.B., and Pennarola, N., 2020, Management of remnant tallgrass prairie by grazing or fire in western Minnesota, 2016-2017: U.S. Geological Survey data release, https://doi.org/10.5066/P9N8X0ZY","CC BY (paper, not sure about data?)","CC BY (paper, not sure about data?)"
GRP,61,1,2015,"Norland, Jack, Larson, Tyler,Dixon, Cami, Askerooth, Kristine",Outcomes of Past Grassland Reconstructions in Eastern North Dakota and Northwestern Minnesota: Analysis of Practices,Ecological Restoration,NA,NA,R-S,NA,NA,NA,NA
